{
  "$schema": "../../../schemas/addon-store.schema.json",
  "id": "wealthfolio-rebalancer",
  "name": "Wealthfolio Rebalancer",
  "description": "Portfolio rebalancing addon for target allocations and long-term portfolio planning.",
  "author": {
    "name": "ibalboteo",
    "url": "https://github.com/ibalboteo"
  },
  "trust": "community",
  "status": "pending",
  "tags": ["portfolio", "rebalancing"],
  "repository": "https://github.com/ibalboteo/wealthfolio-rebalancer"
}
