{
  "$schema": "../../../schemas/addon-store.schema.json",
  "id": "asset-and-cash-timeline",
  "name": "Asset Amount & Cash Timeline",
  "description": "Tracks cash balance and asset accumulation over time with transaction-level insights and holding timelines.",
  "author": {
    "name": "bryanrvo1511",
    "url": "https://github.com/bryanrvo"
  },
  "trust": "community",
  "status": "active",
  "tags": ["cash", "analytics", "timeline"],
  "commercialModel": "free",
  "repository": "https://github.com/bryanrvo/Asset-amount-Cash-Timeline-add-on"
}
