{
  "$schema": "../../../schemas/addon-store.schema.json",
  "id": "simplefin-sync",
  "name": "SimpleFin Sync",
  "description": "Automatically import bank and credit-card transactions from SimpleFin, with correct balances, pending reconciliation, and internal-transfer linking. Optional Telegram reports and commands, and automatic categorization of Amazon charges from their order emails.",
  "author": {
    "name": "Bubbles840",
    "url": "https://github.com/Bubbles840"
  },
  "trust": "community",
  "status": "active",
  "tags": [
    "banking",
    "import",
    "sync",
    "transactions",
    "spending",
    "telegram",
    "categorization"
  ],
  "commercialModel": "external-service-required",
  "repository": "https://github.com/Bubbles840/wealthfolio-simplefin-addon",
  "supportUrl": "https://github.com/Bubbles840/wealthfolio-simplefin-addon/issues"
}
