{
  "$schema": "../../../schemas/addon-store.schema.json",
  "id": "dividend-tracker",
  "name": "Wealthfolio Dividend Tracker",
  "description": "Dividend tracking by year, month, and security with stacked bar charts and per-account tables.",
  "author": {
    "name": "ragnarok896209",
    "url": "https://github.com/ragnarok-89"
  },
  "trust": "community",
  "status": "pending",
  "tags": ["dividends", "analytics"],
  "commercialModel": "free",
  "repository": "https://github.com/ragnarok-89/Wealthfolio-Dividend-Tracker"
}
